"","x"
"1","Hi i am new Samsung user, I have brand new Galaxy Fit band and steps are way off. I did around 300 steps around apartment thi morning but Fit measured over 1400 steps, that is way way off. Any suggestions."
"2","Yesterday I had perhaps 80% storage used on my S9 on Android Pie."
"3","My gear sport did a software update approximately 2 weeks ago. I am a runner who often runs 5ks. I have a particular running trail that I use often. I used this trail so often that I know exactly how far a 5k is. Before the update, my watch tracked the mileage accurately. After the update, my watch does not track the mileage accurately. Every time I run a 5k (3.1 miles), it says that I only ran 2.6 miles. How do I fix this?"
"4","So I have had my gear sport for nearly a year. I usually have my samsung health app set to only count steps on my gear sport because I wear it all the time except when I am showering (that is when I charge it.) All of a sudden, this afternoon it switched to ""all steps"" on its own. Problem is that this makes it double count the steps when I have my phone on me. My gear sport has only 6800 steps on it. But my app says 9700 steps. And I only took my watch off in the shower so the 6800 steps is accurate. When I try to switch the app from ""all steps"" to my wearable device, the gear sport no longer shows up as an option. The only options are ""all steps,"" ""mobile phone,"" or ""gearfit 2."" I haven't used my gearfit 2 for a year. I am a health and wellness coach so I would really like my app to be accurate. How do I fix this?"
"5","Why is the New Galaxy watch not supporting"
"6","Trying to watch sky q and saying your device is currently being registered. New to Samsung and I'm so confused. Wont let me watch anything"
"7","Hi Community,"
"8","Has anyone else had issues connecting to TV via AirPlay2 using Apple devices?"
"9","Samsung Smart TV Keyboard not working . Model:UN40KU6300F."
"10","Is there a way to disable charing icon in last software update number R810XXU1CSD6, One UI version 1.0? It is a little bit annoying when charging at night."
"11","According to the WWE website, my television (55"" RU7100 HDR Smart 4K TV [UE55RU7100KXXU])"
"12","I have it on my Samsung galaxy j5 but hubby cant download it to his galaxy a3. Anyone help x"
"13","We have one user that is having a problem with her calendar syncing through Activesync. Calendar syncing just stops. When going in to the settings, account her email will have a recent last synced, but her calendar will have hours since last synced. It doesn’t resolve itself and the only way we have found to fix it is to remove the account and re-add it. She had a Note 8 and just moved to a Note 9, both exhibit the issue. Looked at her Exchange Active Sync settings and couldn’t find any issues with it. We setup the Google Client and it works without issue."
"14","So I'm trying to set up Samsung Pay and I entered all the right information and it said my card is invalid like wtf"
"15","We have a samsung smart TV and have Philips SHC8535 headphones. They've both worked together with no issue for 5 years however several weeks ago the headphones no longer work with the TV. The headphones are working as we've tried them on other devices, with no issue but the headphones and TV no longer seem to co-operate. Any ideas how i can rectify this?"
"16","I have a fairly new 1080p Technika semi-smart TV. It has USB connections for disc storage, I can configure it's network settings, however it doesn't have any built in Bluetooth or WiFi. I wanted to send the screen from my computer to the TV without having to use the HDMI I'm currently using. Will either of these Samsung products work for that or am I looking at the wrong thing?"
"17","Just got an S10+ and installed Flow on my computer. Some of the features in Flow are good but I wanted to be able to automatically backup certain folders / file types as soon as the phone is in range again. At the moment, the only way to do this seems to be to manually transfer one by one. Would the team developing Flow be able to add an auto copy / auto transfer option so I can select a folder and have it either make update the computer stored backups or transfer the files over?"
"18","Clearing the Calendar Storage cache and storage doesn't help. My fiancée and I have the same problem and the common factor is that both of us own the S7 and 2 smart watches(me: Gear S3, hers: Galaxy Watch)."
"19","Why does my say health app say I was walking when I was actually running? And it records a less distance than what I ran as well as less calories."
"20","Hello, I'm looking for stock firmware (XXV) of Galaxy Watch Active. Anybody have it? Please share it, Thanks a lot"
"21","Ive been using my galaxy S7 for years now and I am mostly pleased with it (other than battery life). Until few days ago that is. It started freezing and restarting on its own in different apps (whatsapp, chrome, games..). One time it even froze when I wanted to check what time it is by only pressing home button. I have cleared system cache and cache and data of few apps that I was using when it restarted but it didnt help. I dont see any other option than reseting to factory settings which I will do later on. Does anyone have any idea what could be causing this and any fix for it?"
"22","Hi, just wondering if anyone knows how to change/customise the swimming pool length after one UI update, I can't seem to find how."
"23","My Samsung TV (UE49MU6179) just automatically updated to firmware 1270. This update seems to include changes to the Tizen browser, since I'm no longer able to watch livestreams on Twitch.tv."
"24","Does anyone know why my camera on snapchat Facebook Instagram is really zoomed in its not very flattering and I've no idea how to change it anyone ideas??"
"25","I haven't received any software update to my GS8+ since 1year."
"26","Here is my latest software update information:"
"27","My Q9FN was purchased in Septemer 2018. When playing movies the videos will regularly flash a split second of white sometimes black."
"28","Is anyone else having trouble with the GPS on the S3 since the last software update? Mine keeps either freezing of not measuring accurately."
"29","Auto sync music tracks has filled up my Galaxy Watch memory so that now I can't even set an alarm because of memory is full errors."
"30","Hi All"
"31","Their update on the 15th of May rendered the expensive clear view case useless for many of us. Samsung support suggest basically resetting the phone to factory settings - but wouldn't that just mean the same faulty update would be pushed to the phone again?"
"32","Hello,"
"33","Android OS app, used 80% of all my mobile data allocation in one day. All data used in Android OS background, but with S6 you cant swith off background in Android OS like you can in other apps. Contacted Samsung suuport and they can't help even though they used smart tutor. currently have to have mobile data off to save it happening again. Any ideas?"
"34","Getting error message All4-T008 when trying to load it on my SAMSUNG UE40NU7199 tv"
"35","Hi"
"36","I have my own application able to send notifications. All notifications works on phone."
"37","Haven't been able to reach or access my emails on the S10plus after transferring from old Samsung. Email address there but no content. No old emails or new ones coming through. Anyone help me on this"
"38","My 5ablet has suddenly stopped playing videos from YouTube and Facebook. Does anyone know why, and how I can resolve this please?"
"39","Hi support,"
"40",NA
"41","Hi,"
"42","Its been a while since I started experiencing this problem on my phone. Whenever I download a video then open it on gallery to check if its working an error message failed to play video appears. Even the video my sister shared to me doesn't play either. I wanted to post video to my sns accounts but I can't due to this. Hope you could help me with this. Thank you."
"43","I was recording videos until my phone wouldn't allow me record anymore . Kept showing ""recording failed "" . I checked for the videos I had record and everything was fine , videos were playing . The next day I checked my gallery and all my videos and some pictures had a sign on them . I didn't know what it meant so I left it alone and refresh my phone . Once back on all my videos had dissapeared, I looked everywhere but no sign of them . I have an SD card insert but I don't know if it has to do with the SD card"
"44","What is the default password for call barring on samsung A30.?"
"45","I have the international version of the S10 Plus working well here in North America on T-Mobile except for a few minor bugs. The most annoying of those is the behavior of Wifi Calling."
"46","Can someone tell me why the Samsung S10 phone line in the USA just got a $200 price reduction, but the UK or any other country didn’t? That means it is now cheaper to buy a phone from the USA and have it shipped here, buy a charger and still be better off. Is this fair that the Americans once again get treated better than the rest of the world on pricing or anything else, etc? For those of us that DO buy our phones SIM free, it hurts us right now, for everyone else that is on contract, imagine if your whole contract was $200 cheaper for the whole contract! That means less paid overall and a cheaper monthly contract. Ask you contract provider WHY are we being done over by SAMSUNG? Is the contract provider going to make up the difference, or put pressure on SAMSUNG to reduce their pricing."
"47","Hello Samsung I have a concept idea about a possible One UI 1.2 version for current version of Android and for all devices running One UI including Samsung Galaxy A50:"
"48","In addition to the normal Apple itunes store content to watch/buy/rent, the Apple TV app on Samsung TV has some channels for networks like HBO, Showtime, etc. On my Apple TV device, for example, it allows me to watch content on those kinds of TV channel apps (e.g. HBO GO, Showtime Anytime, NBC, AMC, etc.) with my own provider subscription."
"49","Hi,"
"50","Hi,"
"51","Hi, I am studying in Switzerland. My old phone was broken so I bought a new one which is Samsung Galaxy A40 from Manor shop, Geneva Switzerland. However, next month I am going back to Thailand and by the time I bought it, I did not know that it has regional lock. I have read that many people suggest to make a 5 mins phone call. However, my Swiss sim card is valid only for internet surfing so it will not be able to make an outgoing call. Here is my question, will it unlock if I just surfing (3G/4G) with my phone?, How could I know that the phone is unlocked to use Thai sim?. Thank you"
"52","I have owned all the Notes and most the S series, as of lately its becoming more non-existent of much liking anything about the S10 variants."
"53","I have a suggestion for an app called ""Samsung Beta Club"" for devices running One UI including Samsung Galaxy A50:- Join Samsung Beta Club with other users to get Beta Preview Builds of what Samsung is working on the next updates/builds or next One UI versions- Beta Forum Community/Category- Send Suggestions/Report features- Notices Section with upcoming beta builds -> changelog & release date- Beta Software Updates with improvements, new features and bugfixes- Samsung Beta Club includes One UI Beta Program for all devices worldwide (One UI required) in all countries including Romania- Galaxy Beta Service and Android Beta Program integrated in Android System for Galaxy Devices (SM-A505FN)- Samsung should be part of Android Q Beta Program starting with Samsung Galaxy A50 (SM-A505FN)- Android Q Beta for Samsung Galaxy A50 (SM-A505FN)- Better Support for Samsung Galaxy A50 (SM-A505FN)- Faster OS updates for Samsung Galaxy A50 (SM-A505FN)- Project Treble and Mainline for Samsung Galaxy A50 (SM-A505FN)- Android Beta Feedback Updates with new features and improvements- Beta Preview Updates with all newest features, improvements"
"54","Hi,"
"55","woke up with this burn this morning"
"56","Has anyone else noticed that the AOD doesn't turn off when the proximity sensor is covered? It will dim if automatic brightness is enabled, but it will not actually shut off. All previous smartphones I've used have always turned off the AOD in this scenario, I really don't see any good reason for the display to remain on while it's in a pocket or bag, a strange decision by Samsung for sure."
"57","Text in settings have gone black and with a black background have become unreadable. How can this be fixed?"
"58","Hello,"
"59","My text messages on my Galaxy Note 8 just randomly disappear. Incoming and Sent Messages. Sometimes they reappear and sometiesothey Don't. Is any one else having this same issue?"
"60","Recently done the latest update to android version 9. Nd the way message notifications are have changed."
"61","Hi everybody, what happens is that I have problems with the pendrive Samsung MUF-64BE3 / EU 64GB 3.0 (3.1) every time I try to give a new format when formatting the pendrive works well for a slight moment and then disconnects and continuously appears that there is an error with the pendrive, the problem persists when formatting NTFS or ext3 and only lets me give it the factory format, the reason for giving the mentioned formats is to be able to save several ISO.Can anyone knows how to solve this problem? Thanks so much."
"62","I know, I'm newly active in the UK community but found a petition about One Ui created by some users in here."
"63","Hi,"
"64","Going into the software update and pressing ""later"" removes the notification.. but only for a day or so.. is it possible to perma disable the new software update notification?"
"65","For my lock screen, I change the right app to the camera. Sometime later it will change to an app I've installed, Brewster's. If I change it back or change it to anything else after a little while it resets and is back to Brewster's. Any ideas on how to stop this? I looked on the brewsters app and did not see a setting there"
"66","Network change from 4G LTE to H when calling. And most apps don't work or very slow down while talking on the phone. Other phones with same service and sim card don't have this issue."
"67","My smartphone keeps disconnecting every bluetooth app I have especially one in particular. I did everything from re installing the app, clearing the bluetooth cache and removing the optimizing battery thing for that app. It connects for a second and then ""Disconnect BLE"" so you want to reconnect yes or no or No or confirm but it never works... Anyone had any idea?"
"68","My A7 2018 had a firmware update a few days ago and I immediately noticed that images were now pixelating in apps (pinterest, Twitter, Instagram etc) and on webpages. It's a really disappointing upgrade. Also apps have become unstable and the close randomly or the phone reboots randomly. Please advise - I've cleared cache, updated all apps."
"69","My TV is model UN65NU6080FXZA on 1251 firmware. Called 2 weeks ago about the Apple TV app not showing up. The rep confirmed that my TV should have it. We attempted a hard reset and smart hub reset with no success for the app. I waited 2 weeks to see if it will show up. Still no ATV. I put in a ticket #2212047910 and spoke with a rep. This rep told me Apple TV is not yet available for Samsung and to wait. Did I just get blown off?? Now I’m not sure if I just got bad service or something is wrong with my TV. What do I do now?"
"70","Bit of an unusual problem. For some reason, the ice maker will only dispense crushed ice regardless of whether ""cubed"" is selected or not. I've emptied the ice out and ensured that all the ice is cubed but each time I dispense ice I can hear the blades chopping it up and crushing the ice. I think the selector maybe the thin metal bar that runs the length of the ice tray and sticks into a square hole at the back where there is an inch square shaped fitting. This flicks forward a curved plastic piece that lifts the ice up so the blades can chop it up. I suspect that the selector is stuck. I've checked for ice etc and there's nothing mechanical at the front of the dray, so it must be the square selector thingy at the back of the fridge?"
"71","Hi,"
"72","Hi there,"
"73","Been using it for more than a week now and I keep having this unlocking problem for like three to five times a day. Screen won't respond regardless of how hard you press your finger on the on-screen scanner area. Will have to press the power button instead to unlock using face recognition. Anyone having the same?"
"74","I am having few random software issue in my samsung galaxy S10 plus feom the day of purchase. At the start I ignored it but eventually it led me to factory reset my phone and it has still not been resolved and since from day one it has been malfunctioning it means there is a manufacturing defect. Will samsung replace my device?"
"75","Just got tab s5e bit dissapointed still not able to connect my galaxy watch to it, another tablet now being returned to ee because it does not do what i want it to do."
"76","When swipe up is done no older e mails load? Never had this happen before"
"77","Hi,"
"78","i switch on the loudspeaker during a call by touching the speaker icon on the Phone app. after some time i find that altough the icon is still on, the loud sound has gone. then i touch the icon again to first switch it off and then again to switch it on and the loud sound is restored. it is very irritating to see that what is otherwise 'flagship' phone of the company has such issues"
"79","Hey,"
"80","Just wondering why i cant use samsung pay on my s3 frontier. Everywhere i look it says it is available but I can only get it kn my S8"
"81","hi folks, tonight while watching youtube my j600fn went off and came back on with a black screen only displying the top of the phone (white text battery time wifi etc.)"
"82","Hello. I have the Samsung A50 for almost two months. From times to times, when receiving a gsm phone call, even though I answer, I can’t hear anything and neither the caller doesn’t hear a thing. Has someone experienced the same issue with this? Thank you."
"83","seem that the battery is being drained quickly since the last andoid update , any idea ? -May 2019. S9+"
"84","I have a brand new s10 plus and i noticed (esspecialy in instagram) the colors of pictures are desaturated and wrongly RGB calibrated. This issue can be fixed by opening blue light filter and reduce its opacity to minimum. But its not a safe solution, Samsung should immediately fix this with an update. We bought the best display on market and its color space is all wrong. Anyone have the same problem please post below."
"85","I have a samsung S9. I updated my software to the lastest oneUI with android pie update two months ago(or whenever is was released). About one week ago I have been recieveing notification sound while my phone is set to vibrate only or silent. My media is on but everything else (notifications, ringtone, system, bixby voice) is all muted. However, I still get notification sound. Before this issue came up i would not recieve notification sound when my phone was set to silent and my media volume was on. This issue is very annoying especially when i have class. I went to a walk in samsung support store. But they could not give me a good solution besides wiping my device completely or going through each application and setting it to silent."
"86","Hi All"
"87","I am facing issue with Samsung Tab A 10.5 Keyboard. while using the tablet in landscape mode, I am not able to write and keyboard coming and disappering. Due to disappear of Keyboard not able to write anything."
"88","I have a Galaxy s10e with a contact that is in my work google account that I need to move to my personal google account. I see no way to edit this from the Edit Contact UI. It shows the location at the top of the editing screen, but I don't see a way to change the location. I know I could just delete the contact and save it under the correct account, but in previous versions of Android/Samsung Experience, I was able to change the account the contact was in after the fact."
"89","This only started 2 days ago but it is infuriating and making me consider a factory reset. Regardless on whether silent, vibrate or sound notifications is selected, a notification chime will always play when a notification comes through. This also bypasses do not disturb mode, making me even more confused. Very likely a glitch and interrupts all videos and such making it extremely annoying, and cannot find any other examples of this online either. Please tell me if i am being stupid to fix this."
"90","Hi All, My Samsung galaxy S9+ has become useless for calls after updating software to Security patch level 01 May 2019 today. Patch version G965FXXU4CSE3 / G965FOTF4CSE1 / G965FXXU4CSE1. Can hear calls, but when press/slide receive button then it disconnects., though call is still showing active at caller end."
"91","Now that Samsung internet has inexplicably removed the video history option, are there any other browser options that let you view, and download, your history?"
"92","Hi Community,"
"93","So I have several portable chargers they used to fast charge my samsung devices one day this has just stopped and they only cable charge. I have an s6 and an s8 and have the exact same issue with both of them. They will only cable charge from the portable chargers but they used to fast charge.I have tried different cables and today I went into a phone store and the guy there tried all of his portable chargers and cables he had for sale and on both phones the same issue happened they would only cable charge even though all of the chargers i used said they fast charge on them.He tried the portables on his own samsung and it wouldn't fast charge either.Have samsung done some software update that stops fast charging from portable chargers? Like I have tried 8 different ones on 3 different phones and none of them will fast charge.It seems like something has been changed where they used to fast charge but now they don't anymore. Anyone know how to fix this? Or did Samsung mess something up on the software updates?"
"94","Will Samsung ever partner with ""Clue, the period tracking app?"" Clue is the best period and ovulation tracker for me and it would be amazing if Samsung wearables partnered with them because, having it conveniently on my hand would be amazing when my phone is out of reach. Lol in begging you all to because its the only app I use. If not please offer something better or make an app just as better but I honestly think it doesnt get any better because clue also tracks your period even when you have irregular periods... I really just would like to have the same on my watch."
"95","on S10e volume up and down buttons are a bit small, for people with big fingers it would be helpful to have a bit longer/bigger buttons. And Fingerprint on display instead on home button more pleasing and then phone case can cover the home button."
"96","I have the Galaxy Watch 42mm and ever since todays update my watch disappeared from samsung health and it only counts my phones steps or combined."
"97","Hi there"
"98","Did anyone notice a similar problem like this one:"
"99","I saw S Suggest program in my activity history and i didnt open it.Im using this phone about 3-4 months and i saw this once.is it malware?(I'm living in Turkey?)"
"100","Will 5g ever be available to my new S10e"
"101","Hi guys"
"102","Hey,"
"103","Been informed that this is the place for me to feedback and request changes and the software techies will see it."
"104","It started when I updated my s8+ to the latest operating system, a few weeks ago. I figured it was something that my phone couldn't handle because the update was made for the s10 series. The status bar would completely dissappear and the only thing I would see is my phone carrier logo on the left hand side. Then it would come back whenever it wanted to. This is annoying because I like to know what percentage my battery is on without having to swipe the whole bar down. Fast forward, I just upgraded to the s10+ maybe 2 weeks ago and everything was great but as of 2 days ago my status bar has disappeared again. I have checked every setting and I can't figure out why it's doing this. I'm pretty sure it shouldn't be doing this."
"105","I upgraded to this drive a few days ago."
"106","So I've had my new S10e for two days. I like it so far, but have I ran into one issue that is driving me bonkers. When I adjust the notification volume it does nothing. My notifications seem to run off of my ringtone volume, but use the notification sound. Anyone had this issue, or know of a way to fix it? I see it happen with the reddit and quora apps mainly. Facebook notifications are quieter than other notifications, the same way it was on my S9+. I've never had a Samsung flagship other than my S9+ that I had for 30 days, and now my S10e. I never had this issue with LG or Motorola."
"107","Hi guys i am trying to find where the heck can i set a high heart alert after updating my gear s3 to One Ui....any help?"
"108","I would love to use Samsung pay but it is not possible due to the fact Samsung is not registered with my bank TSB"
"109","Can anyone advise me on who to contact in samsung, regarding an innovation idea that would save many lives and injuries per year worldwide. I have been working on this project for over a year, done my research and found that no mobile phone maker has applied this into the operation of their phones. This application would be an asset for samsung and could be made to be expanded in other areas. Please, please help. Michael Matthews."
"110","Hi all,"
