"","x"
"257","Does anyone know where user feedback can be sent to the devs of the actual Good Lock modules, as this seems to be more of a community chat area rather than a development forum?I'd like to request the very obvious (albeit legacy) 'Menu' button as an option currently missing in NavStar - alongside some of the largely useless extra ones that they do provide. I've always had (or created) a physical menu button at the bottom of my phones, located where I can get at it quickly and easily with one hand, and I still have no intention of bowing to Google's trendy Material Design nonsense about Menus really being 'Overflow Lists' floating somewhere around the screen if you can find them.Also, I'd like to see a new module to adjust physical button actions - particularly to use three-button cabled headsets for changing tracks/albums with MEDIA_NEXT and MEDIA_PREVIOUS events (as per many other non-Samsung devices) instead of altering the volume for which I already have perfectly usable buttons on the phone itself. It used to be really easy on my previous Samsung devices to simply edit the Generic.kl keyboard layout file (needs root) but it would be lovely to have a simple (and Pie-friendly) way to do it on my new Galaxy A70.If those two options were available, I finally think I can live with a mobile device without rooting it, which would be a first for me."
"258","OK, so I've decided to sell my S3 Frontier, unless there's a way to solve the insistence on connecting via Bluetooth.Since the latest update to Tizen 3.0 it looks like Samsung have made it more difficult to use without it being connected 24/7 to an Android device via Bluetooth, which begs the question. Why don't they drop Tizen and use Android Wear instead.Prior to the update I could wear the watch and leave the Android phone at home after solving the issue of the nagging Bluetooth connectivity issue. I don't use the Android for anything but managing the Frontier anyway. There's just no way the watch will perform other than like a dumb watch if it isn't connected to Android via Bluetooth. I still want to monitor things like steps etc and connect via Wi-Fi.As soon as the watch is disconnected from the phone via the Galaxy Wearable app within 10 minutes it's nagging to be connected via Bluetotth evey 10 minutes again. This is no good to me at work where we are required to leave our phones switched off in lockers, and it gets a PITA carrying 2 phones around all the time as well.Samsung need to sort this out and give us the option to use the watch without the need for a 24/7 Bluetooth connection."
"259","My Samsung screen changes into very light yellowish colour after start up"
"260","Hello!"
"261","Hi ,like in title, after udate when conecting laptop wirelessly(screen mirroring) to tv, game mode is disabled. Before in version 1153.3 it worked. Is it any solution to fix this or uninstall upgrade? Is it any option to do it in service menu?"
"262","I tried pairing two Samsung Smart Remotes to my new Samsung Q80 TV but within 10-20 seconds I get a message that the TV is already paired with a remote and then unpairs from my first remote; this despite both remotes working just fine during that brief period. Why would Samsung not allow this? Is my only option third party remotes? Is there some way to do this with the Samsung Smart Remotes?"
"263","Despite this subject is still in development. There are some websites listing the Samsung Phones that will be compatible with Android 10 Q, which will probably arrive at autumn 2019. The Galaxy Note 8, is still one powerfull phone, surely capable of running Android 10 without a problem, but it's still not yet on the lists."
"264","I can't turn on ""do not disturb"" and set a custom exception for a specific app. Now when my phone is on DND my house alarm activations app won't alert me if the alarm is screaming."
"265","Hi,"
"266","I recently swithced from a Iphone 8 to a Samsung S10, my husband also has the Iphone 8 and he is able to recieve my messages but I dont recieve his. Ive tried re inserting the sim and shutting off the facetime and imessage on old phone and re starting both phones but it didnt seem to work. As far as I know his phone is the only one that he has to ""oush"" message as a SMS in order for me to get it. Any Ideas>?"
"267",NA
"268",NA
"269","Version 2, more cleaning will come in time to make this watch-face a brilliant information dashboard on your wrist .https://www.facer.io/watchface/RgkKRhJcGZ"
"270","My issue is the sound on my earplugs. I am able to customise the sound on wired earphones/plugs, in the phones sound settings. Which is extremely useful to me because I am hard of hearing in one ear and 98% deaf in the other. Though sound filtered through the practically deaf ear is customised and optimised for me. Its amazing."
"271",NA
"272","I'm new to the above device, and I want to use it principally to display position on maritime charts - a Third Party package will be installed, probably onto micro-SIM card. Wifi positioning is displayed OK via Google Maps. There is no info I could find in the Samsung-recommended User Manual, save a reference in a layout diagram to 'GPS antenna'."
"273",NA
"274",NA
"275","Once I choose the app to download, it tells me to sign in to my Samsung account, as soon as this is done the app. Please help"
"276","With 5G being announced today by EE and Vodafone, is anyone else considering getting the S10 5G? My main reasons for wanting to are because I'm underwhelmed by the S10+ battery and also want the 25w fast charging offered by the S10 5G."
"277",NA
"278","When I'm on a phone call and my phone receives another call the only way to to answer it after hitting the green button is to select from the menu that appears whether to end or hold the existing call..."
"279","This morning i install the latest software update on my Galaxy A6, it completly wiped all my contacts. When I try to re-enter them, I get a message saying ""unable to save contact"". I have tried resetting all permissions but still have the same problem"
"280","I just purchased an unlocked Galaxy S10e phone and just noticed on the box that it reads European SIM Card Only."
"281","What is the simplest procedure for installing the Tizen OS on my Samsung Smart TV Series 7 UE40NU7120?"
"282","Hello"
"283","Samsung should make a dryer that tumble two directions it should tumble left for a minute or two then right for a minute or two to keep laundry from bunching up like for instance a large comforter it balls up and then you need to unbundle it so it drys but it’s so tight rolled it drops like a stone in the dryer this multi direction would keep it from balling up just a suggestion thanks"
"284","I have two 7100 models and both have the new Apple TV app. However my higher model 7120 cannot find the Apple TV app. The firmware is 1252, right up to date. Will it be made available for the 7120?"
"285","Having issues with pairing with my Beoplay E8, followed all the steps from Bang and Olufsen"
"286","Hi all,"
"287","brought this samsung s10 plus after trying out the p20 pro last year and i get 1 to 2 bars its been to a repair center they said its fixed which is a load of *****"
"288","I've noticed through all sources; aerial, hdmi or just the in built apps, the picture will ""blink"" for half a second after transitioning from dark to light. It doesn't do it all the time, but it's a daily problem. I've tried unplugging everything, but it still does it. Samsung claim they've never encountered anything like it. Below are some video clips of what it looks like. I've had to slow it down so the camera could pick it up."
"289","My watch battery started draining rapidly after May update. This is really started to be annoying. Each update they fix something and break other stuff. This is started to be a bull*****. The last update they fixed the battery drain and broke the encoding for some languages. This update they screwed the battery again. I don't know what kind of engineering is this?"
"290","On pc the IconX have two different output options and one seems to be much lower quality audio for some reason, of the two one of them (Headset) is the only ne that displays all audio when in any sort of call that i'm aware of the headphones setting mute other audio and just plays the call, I don't know why this is happening or how i could fix it, if anybody has some tips on how to solve this I'd be really grateful"
"291","Hi there,"
"292","Why wont Samsung pay accept my card? I'm with Barclays one of the biggest banks in the uk. A major issue for me as I bought the phone on that premise. Luckily for me I'm still in my cooling off period if I cant get it sorted."
"293","Hi I've tried resetting the watch and still no joy!!"
"294","As the description says I’m looking for a video file converter because my Samsung TV doesn’t want to play all video files connected trough a HDD or a USB."
"295","Hi when I turn on UHD Color for the HDMI on my Xbox one x or PS4 pro I get occasional screen tearing and the screen flickering black. The model number for my Tv is UE55MU6120. Any help with this issue will be greatly appreciated"
"296","I recently took my tablet in for repair as it had a faulty battery. Samsung ended up completely breaking it. I was told it was unrepairable and I would be offered a replacement or a refund. As the tablet was 5 or 6 years old I did not have the original paperwork so could not confirm how much I paid for it or where it was bought. After 10 days Samsung finally offered me £80. I consider this insulting. I was further told that I would not be offered any compensation for the inconvenience caused by Samsung. Has anyone out there had any similar experience, or can anyone offer advice as to how I should proceed as I have no intention of letting Samsung get away with this. Thanks."
"297",""
"298","Does anyone know how to page up/down using tab s4 keybord."
"299","Hi guys,"
"300",NA
"301","Recently bought a refurbished Samsung J6 (SM-J600FN). Seems fine with the exception of one very big issue: my speaker will randomly cut out and stop playing audio for a random length of time. Often I won't even be able to play a minute of a youtube video before the speaker fails."
"302",NA
"303","My Gear S3 Classic Alarm stopped working for me after the May 20th update. The alam widgets are not working, the message on the watch says loading but never does, it says , ""Loading failed tapto reload"", it never does. If you try to add an alarm through the watch app menu's it just freezes or crashed. Please push a update to fix this is an important part of the watch"
"304",""
"305","Hi All,"
"306","I have a S10e that came with a Fit2 Pro. I've had Gear Iconx earbuds that I used with my old S6 Active with no issues. Whenever I start a Mapmyrun session when my Gear Iconx earbuds are already connected Mapmyrun records position but will not recognize the heart rate data even though it is visible on the watch display in all other modes including the watch face. The fix seems to be to remove the earbuds and put them in the case so they disconnect, start a Mapmyrun session, confirm heart rate is showing in the Mapmyrun app, take the earbuds out of the case, and put them in my ears. If I go in that order audio and heart rate both work. It is as if the audio is sucking up all the Bluetooth bandwidth unless I start Mapmyrun first. Any ideas?"
"307","Pretty simple, last night I was wearing my watch like normal recording my shocking sleep patern and then this morning the watch has taken on a life of its own, opeing apps I'm not selecting, switching watch faces, going into settings etc to the ppint I've struggled to do anything with it. Tried the obvious ones switched it on and off and I've reset it and then relinked it to my Phone twice with no change Its like its taken on a life of its own"
"308","I love the speech to text keyboard however my only gripe with it is that I can't seem to start sentences with a capital letter. Is there a way to correct this or is it a software error? My job would be so much more efficient if I could get it to use capital letters at the start of each sentence."
"309",""
"310",NA
"311","Just want to be sure,is it up to me or my samsung TV.."
"312","Our 40” Samsung turns itself off after I think two hours of viewing and I cannot see a setting to stop this. There is no eco setting on or anything similar so not sure why it’s doing it."
"313","Hi."
"314","I have just gotten a new update on my samsung tv 2018 version, there is additional menu ""Airplay settings"", however although its ""on"", my mac doest detect the airplay display. Both mac and tv are on the same WIFI as I can use chromecast."
"315","Hi Guys, first time poster here and i really would appreciate some expert advice."
"316","Hi,"
"317","I have just done this update but it's so bad. I can't go back to my old really good phone settings because apparently you can't so I'm stuck with this crappy useless update."
"318","I have bought a new Samsung Galaxy J6 a few months ago. Whenever I place a call the screen turns off but screen do not turn on automatically when I remove the phone from my face after receiving call and I need to press the power button or finger sensor to turn it on. I thought it is a hardware issue but when I go to settings of *#0*# and select sensors the proximity sensor show the value 978 adc when I place a finger on the proximity sensor and when I remove the finger it shows random number."
"319","I live in a rural area. Can anyone tell me if any of this vacuum will pick up large flies and stink bugs? Dust and hair are just part of the accumulation in the country. The bugs that get in an old house, are much bigger than dust and hair. any experience on this?"
"320","Can someone tell me when this issue is going to be sorted out? Yet again, only a couple of days after going through the process of clearing various caches and storage and getting my watch counting steps and floors it decides to stop working......argh!!! This is a keep or return issue"
"321","Hi."
"322","Hi I'm new here and hope you will be able to help me. I have a Samsung galaxy gear Sport. The watch has maybe 4 months I bought it in the end of January."
"323","Greetings,"
"324","Hi guys I was just wondering is there any1 else with an s8 who hasn't received the Android pie update? Every1 else I know has received it that owns an s8."
"325","Found a problem when using face recognation while wearing sunglasses ."
"326","New s2 tablet. If I set time to auto, status bar time is 1 hour earlier while weather/time widget on home page is correct. If I turn off auto and set time manually, then weather/time widget is 1 hour earlier. Please help?"
"327","So, I went to turn on the Dolby Atmos setting on my Samsung Galaxy S8 and it was greyed out and I can't select it, any solutions?"
"328","Hello i have a samsung ue50nu7472 50"""
"329","I have just bought an galaxy s5e tablet on the basis that I could use the call & message continuity feature with my Note 9. I can't find any way to make this work or find the app in the store. Is there an app I can download or do I need to wait for an update? If so when will this update be available or will there be an update at all?"
"330","Seeing how Android Pie has been destroying phones since it came out, I would like to know if it is possible to keep Android Oreo on your Samsung S9+ if you buy one, considering it comes with Oreo by default."
"331","Have had the TV for a number of weeks - all working fine (primarily using Apple TV box). Added a LG 4K Blu-Ray this weekend and now seeing some strange behaviour."
"332","Hi my gear s3 frontier keeps disconnecting from my Samsung a50 has anyone else had this problem please and if so did you resolve it thanks"
"333","Cannot believe finger sensor wont work with screen protector. So ridiculous!"
"334","My 8 series 65” has started behaving very strange. When I go into the universal remote and set sources for my Sky box, PS4 and Chromecast then changing one of the input selection seems to change the input for all of my inputs."
"335","Just a quick question is the 5G model plus only?"
"336","Does anyone else have any distortion from their lower speaker when playing on full volume? I rarely listen at full however notice that some songs at certain frequencies are distorted. I know it's not from low quality songs etc. as I've tried it with a few songs..."
"337","So I have a Samsung Q6FN55 TV and a N850 soundbar. Recently the audio via ARC has just stopped working, still works fine over WiFi/Bluetooth."
"338","Hello I have some suggestions for Samsung Galaxy A6+ (2018):"
"339","Hello,"
"340","Hi,"
"341","Anyone else unable to get pc passed though there N950?"
"342","Hey,"
"343","Hi, could someone explain this option "" Favorite media app''to me? Explain a scenario in which this option could be used."
"344","Hi anyone know how to save favourite contacts to home screen on note9"
"345","My holiday photos has disappeared from my S10+ gallery. I cant find them anywhere. Does anyone know why this happened and how they can be recovered?"
"346","Hi all,"
"347","Hello,"
"348","Just been doing a video recording and suddenly it stopped recording and went back to the home page. Didn't save the video. Anyone else had this happen and how do I stop it happening again. Thanks"
"349","I only have a simple little suggestion/request. Could you add the option where the phone is smart enough to switch automatically within the ""Data usage"" option , the ""Mobile data"" option - ""Access the internet through your mobile network"", based upon your location when it detects that it's near your home WIFI network? This would save the trouble of always manually switching when I get home and back to using the network carrier service everyday to save on my Data usage per month in my Mobile carrier network. It seems to me if the security works this way to unlock my phone, then can't my Data Usage work that way as well? Thankyou for taking the time to read this."
"350","Has anyones earbuds came yet my claim was validated on the 25th of March but still no sign of my buds as anyone else had this problem."
"351","I love my Samsung gear, my new S10+ is fabulous but I do wish Samsung would be a little clearer regarding free promotions. I believed that I could ckaim the free air buds , but not the case, only if one purchased the 512gb of 1tb version, really! I am as loyal to Samsung as my beautiful dog is to myself, I have had the S3,S6,S7,S9 and now 10+ in addition to my Samsung tablet, my 55"" Qled tv . What more loyalty warrants a free set of wireless earbuds? Stick to your base Samsung and they will take care of you!"
"352","Hi, I recently bought a Samsung Galaxy Ace S5830 from Ebay and it came with android version 2.3.2. I tried every way of updating the firmware with no success as I was unable to install any apps on the phone. I have recently downloaded a update file for android 4.1.1 or something along those lines anyway I applied the update via SD card and now the phone will not boot up. I am struggling to find a suitable SD card update file as this is an old phone, I would be happy just to upate the android version to latest version suitable for this phone (2.3.6 or 2.3.7 seems to be mentioned on other sites). Would really appreciate it if anyone was able to supply an update file for a suitable version of android for this phone that I could copy and install from an SD card as I cannot get my phone to work at all currently. All help appreciated. Kev."
"353","Hello, I recently purchased a samsung Ecobubble washing machine on the strength of the cashback promise which was advertised at the time."
"354","Since a few days my Samsung TV plays commercials before videos although I’m paying for YouTube Premium."
"355","Hi,"
"356","Hi so I've had my Note 9 for a while now and never really had any problems with it till now. It will charge but it's very finicky with what position it will charge with. I've tried different chargers and also I've used air in a can to possibly remove anything stuck inside. It still wont charge unless is a certain position. Please help."
"357","Hello."
"358","I have had my Galaxy Note 8 since around 17 months without any problems, but since last one month or so, the phone has started giving out a mysterious sound - as if you are making a gentle tap with your finger nail onto a hard plastic, or a bit like the crackling sound we used to hear on old radios. Just gives out one tap/crackling sound at a time (not a series of it). It happens about a dozen times in a day."
"359","Hi I have a 55"" Q6FN and I have a little issue with the you tube app."
"360","Is there an authentic way of backing up my Note8 Secure Folder contents onto my laptop (using a USB cable) or external USB drive without having to resort to 3rd party apps/services? As far as I can see, currently the *only* way of doing this is by backing up the Secure Folder onto Google Drive, which I think is unacceptable. I don't trust cloud services, sorry."
"361","Can anyone help with this? Whenever I charge my phone it lasts for less than 24 hours before I have to charge it again. This has been going on for about 2 weeks now. It has always been on 'power saving mode' .I have tried everthing that I can think of to fix the problem but nothing works. I have deleted aps, checked for soft ware updates bought a new battery and even reset my phone back to factory settings without any success. Any suggestions?"
"362","I have a new Samsung Gear - the steps are not being counted accurately. I am still wearing my fitbit to compare and they don't agree by over 2000 steps."
"363","Hi,"
"364","Received the phone yesterday, and have updated the applications and OS to the latest available."
"365","recently have been unable to move pictures from internal memory to sd card. was ok up to a few weeks ago. not sure if last update affected it. but cant move or delete things now."
"366","We've had a favourite song of all time thread, now... let's find out what you're all currently listening to."
"367","Hi,"
"368","I apologize, I dont' know where else to put this than the ""everything else"" section."
"369","I was just wondering, if the Note 9 is so waterproof that you can dunk it under 30M of water for 30 minutes why is there a moisture warning? In addition, unless you exceed those limits water damage shouldn't be a thing, right? Is it waterproof or isn't it? Is it actually safe to use underwater? Or is the fact that you don't want to charge it/plug anything into it while it's wet the only reason it gives a moisture warning?Sorry for asking but getting a moisture warning really threw me off."
"370","Hi all!"
"371",""
"372","Hi everybody. This being my first smart phone, I ineptly poked at what I assume is the S10e's microphone (top right), instead of inserting the tray tool into the SIM/Nano-SD card tray's hole (top left) - got the orientation wrong looking at the manual. Does this mean I might have just destroyed/damaged the mic, or some other part inside the phone?"
"373","I do an high intensity aerobics class called bounce and have just got the active watch and cannot see a good setting to choose for aerobics. I used other workout the other night and the calorie burn was worse than a 30min walk <U+0001F648> I used to do triple that on my Fitbit."
"374","I used to be able to press accent for my spanish keyboard by pressing Alt+E and then the vowel with the accent. However, after I updated my tablet, the function doesn't work anymore. I went to settings to see if I could edit or change but there aren't any options but to turn on and off the keyboard."
"375","Hi all, I've just bought a Samsung 49NU7300 and am wondering if there is a way to connect headphones to it?TIA"
"376","Hi. so i purchased this tv and was trying to play a 2160p x265 HEVC movie from a usb 3 seagate hdd, the movie keeps stuttering (pixelated and sound hangs) every few seconds. it loads fast and i can fast forward without delay, but the playback is awful as i described. the tv is 4k capable and this seems odd. 1080p content is no problem."
"377","I have seen countless videos and articles about changing the colour of your nav bar (especially on demo phones). For some reason I can't do that on my Galaxy S9. If it has been removed, please add it back."
