"","x"
"111","I recently connected my external speakers to my TV using a digital to analog audio converter, converting from the optical audio port to RCA red and white ports to connect to my speakers. Everything seemed to be working great until I decided to watch Netflix, and my external speakers just stopped outputting sound. if I use the TV speakers there is sound."
"112","So when my claim was approved i got an email that it will take up to 30 days for them to be dispatched and i will receive an email when that are. After that month i received an email that it will be dispatched in next 10 working days at the very latest. Deadline came and still no buds or any kind of emails of whats happening with them. Does anyone have the same issue ?"
"113","I -- and judging from posts in various fora on the web, a lot of other customers -- experience lip sync issues with 5.1 surround sound input on the Q90R (firmware v1066)."
"114","Hi!"
"115","Hi."
"116","Hi,"
"117",NA
"118","Hi,"
"119","Not sure if I have the right place for this discussion post but it seemed most relevant."
"120","Hello since I bought my A50 (yesterday) I have a weird bug/issue:"
"121","Turned Apps button on and now can't turn it off. Slider goes grey. After closing Home screen settings it goes blue again by it self. And Apps button is not disappearing from home home screen."
"122","I am having a strange issue with the Samsung Email client. I have version 6.0.02.12 on Galaxy S10+ with the latest OS version from T-mobile ( May 1st security patch level)"
"123","I tried to download apps from the smart hub but it says that this function is not supported, the same apps use to work before ."
"124","Hi guys"
"125","The pie update is the worst update ever. Just saying"
"126","I appear to be having big delays in receiving texts and notifications on my unlocked S10 Plus. The issue doesn't appear to be my carrier (Three) as my partner receives texts from me and he's on the same network, but every day now I'm having big delays in receiving texts, e.g. I didn't get my partner's good morning text until 6pm!"
"127","Hi, After the latest update (today), when staring a run, it does not give a chance for the gps to lock location before you start running? Before the update, you could click ""start"" once location had been found, now it starts timing the run etc before it has found location. So you could be running for a few minutes before location is found!!"
"128","Since the last update, my Gear S3 Frontier is no longer a selection in the step tracker in Samsung Health. All I have is ""Mobile phone"" and ""All steps"". But I think it is actually tracking steps on the S3 because the step count is going up way too fast for the amount of walking I'm doing. I think every step is being double counted, but the Gear S3 and My Note 8. If I set it to ""Mobile phone"" the step count gets cut in about half."
"129","I use my headphones fairly regularly and the other day I went to use them for spotify (Like I always would) and the headbuds don't play any sound but controls on the buds work fine (skipping, playing etc) anyone know anything?"
"130",""
"131","Hi,"
"132","Does anyone know how I can remove the Gear 2 Neo (I have never owned one) from my Samsung Health App and have it recognize my S3 Frontier?"
"133","After Samsung Galaxy Watch 42mm with One UI update, I can't install Samsung health update on the watch. Watch just disconnects when update is installing. I have Samsung Galaxy S9 (One UI) & Samsung Galaxy Watch 42mm (One UI)."
"134","last few days every time I open YouTube app on my TV, and try to watch any video, every time there is a advertisement it auto plays to next video. Is anyone else having this issue with app, I would really appreciate the help. thanks .."
"135","It shows as on in settings"
"136","Hi,"
"137","I am currently using SM-A60F South Africa and I have two friends who use the same phone and they both got Android 9 update, while my ohone is still stuck on Android Oreo. Whenever I check for an update, it tells me the latest update has already been installed. Will I ever get the update?"
"138","Hi all first time ever on a forum but in desperation so please be gentle with me. I've had a Samsung as long as I can remember. My note 8 was working just fine until last update, I had to change and replace one of my 7 direct dial contact which is pretty standard procedure."
"139","I recently updated to samsung one (android 9) and my bluetooth connection is super unstable with all my bluetooth devices. I deleted bluetooth data and cache and restarted my phone and it didnt fix it at all, can anyone help?"
"140","pictures using WhatsApp camera (1x) appears blurry. Even focused picture taken by in-phone camera will become blurry when shared to whatsapp recipient. Any suggestions to solve? Tks"
"141","Good Morning."
"142","I was reading and watching reviews wether its written or video regarding exynos s10 vs snapdragon s10."
"143","I have an issue with my 49"" Q6FN TV with One Remote. After prolonged periods of the TV being off (like 6+ hours), the first time the TV is turned on (using the remote via IR) it takes some time for the TV to start responding to commands (over bluetooth I guess), or rather the remote to send them. Like the TV (or remote?) went to some deep sleep. Pressing other buttons just shows the flickering red light on the remote. It takes about 5-10 seconds. After that it continues to work normally. After shorter periods of being off, there is no such issue."
"144","Has anyone else had this issue? My phone every now and then randomly vibrates 4 times with no notifications or icons in the top of the screen?"
"145","Hi!"
"146","Hi, new to the forum."
"147","With one of the recent updates the alert sound for FB messenger is just a broken clicking noise. Is anyone else experiencing this problem or maybe I have a hardware issue."
"148","cant make or receive calls after update , immediatly disconnects after call is answered ,send or receive , initially thought it was sim card related and fitted new sim , it worked for 1 call then resorted back , tried carrier reset and full factory reset with no joy"
"149","Any ideas"
"150","Hi there,"
"151",""
"152","I have a lot of photos in my gallery folder on Samsung s2 tablet which are held in my internal storage."
"153","Hello."
"154","Hi, I purchased my phone in december 2018, and got my update for Pie when it came out but the Russian version, (probably because the seller imported it from Russia) and im from Croatia. So I updated it in February to Pie but I was getting a message that I need to reset my phone because I switched carriers. So after i reset it, my CSC changed to SEE, and since then i got no software update and no security update, but I found online that Samsung released a few updates since then even for SEE region. Does anyone know what to do and is it a bug or is it normal? Thank you."
"155","Hello,"
"156","Hi"
"157","Hey. My Samsung is somehow connected to my daughters Samsung. When I receive a message...my daughter also receives the message. I am constantly getting notifications from YouTube channels that my daughter watches on her phone. How do I disconnect the two Samsung's?"
"158",""
"159","After connecting my samsung buds to my S10+, the volume bar appears as normal. When the issue occurs the android hearing protection doesn't appear on volume bar in Orange."
"160","I've got a Samsung S8+ and it was updated last week and since then the notificaitons aren't showing up on my Samsung Galaxy 46mm."
"161","Here I am on a (still) shiny S9+, it's May 28, and the phone's still on the April 1 security patch. And this update was released on April 10."
"162","Since upgrading to U1 android 9, Samsung health isn't working correctly- it goes off when screen does. I've set battery to highest I can at moderate level."
"163","Hi,"
"164","Since the latest update the colour contrast is all wrong. Previously with themes the text under folders was White or at least light enough to view the folder name. After this recent update this is no longer the case... I have sent messages to the Samsung members help team and they suggested i change theme. I've installed many themes with white font and the same issues occur. Has anyone else noticed this change since the last update?"
"165","I've had my Samsung A50 for around 3 months and here's my list of problems and despite recent update and factory reset - symptoms persist!"
"166","Hello,"
"167","My phone is rubbish on wifi and I'm not sure why...its really not good at all?"
"168","I have been using Galaxy S9+ for almost two years, paired with my bluetooth system first in Ford Mondeo and for a year now in Volvo XC60. All was well until with probably some update, one day the audio quality via bluetooth got pretty poor. It's a joke - sounds like I am streaming a 128kbps mp3 ten years ago...Yesterday I bought JBL Endurance Jump bluetooth headphones - the same thing...both my Volvo and JBL bluetooth work well with iPhone and even old HTC phone I have (and must use in my car separately to play music via bluetooth) so the issue is definitely my Galaxy S9+."
"169",""
"170","I have an M20, and it turns out not to notify when a message has come in. There is no LED on this model (found that out after I bought it — didn't think to ask after such a basic function beforehand) and I can't figure out how to get the screen to turn on when notifications come in."
"171","I recently purchased the Samsung Q70R and I do use TV Plus to watch BUZZR and Classic TV. The issue on the listing is for Classic TV the show's name isn't displayed anywhere. Only the title of the episode. Also, no info about the episode is available but only a generic blurb about the show."
"172","Hello, i have the Samsung Galaxy S9+ and i always use the finguerprint scanner to unlock my phone. The problem is that yesterday i went to the beach and took photos in water with it, then the finguerprint scanner stops working and a message pop up when i try to use it, the message says "" An error occurred with the fingerprint sensor. If this message appears repeatedly, restart your device"". I restart the device also factory reset it and doesnt work. When i tap *#0*# on the phone appear some white squares and one of them says ""sensors"", when i press there, on the finguerprint sensor test it says that cannot found Data log. What should I do."
"173","Hi I bought A Samsung Galaxy ""Tab A"" 10.5 today and I can't seem to find any information about how to connect it to an HDMI input on either my TV or into my Screen Capture Box."
"174","So, "" Sound Assistant"" app and Bluetooth Dual audio features, are they the same thing? Screenshot: https://photos.app.goo.gl/TRCPAjuo2F6gFbAm6"
"175","How do I prevent an app from using my mobile data? (4G, H+ etc.)"
"176","Good day everyone, I was wondering,"
"177","Hello Samsung Community. I need to ask and request App Good Lock for Samsung Galaxy A50 in Bulgaria and hole Europe to be available to download from Galaxy Store?"
"178","THERE IS NO UPDATE AVAILABLE FOR MY SMART TV MODEL NUMBER UA40J5500AK. BUT I NEED TO UPDATE IT SO THAT I CAN DOWNLOAD NEW APPS LIKE HOTSTAR AND JIO CINEMA TOO."
"179","So, just a few days ago, I noticed that my S9 started to overheat really often and it always loses RAM. Today, I saw it using just 0,9 GB of RAM. This is ridiculous. What's wrong with my phone? My old J7 2016 didn't have such issues, I don't have that many apps. My heaviest apps are probably games such as Super Mario Run or Animal Crossing but I rarely play them. The last time I played them was probably a month ago. I think something's wrong with my phone and Samsung's Device Care app manages to fix the RAM wasting issues but only for a few seconds. It has never been that bad, what is wrong with my phone? I really don't want my flagship phone to get worn out so fast. It's only been months, I have had this phone since December 2018."
"180","I have a galaxy s10 plus and send long texts - usually by cutting & pasting text from a Samsung notepad entry I have set up (eg. directions to my house). Its so annoying its converting them to mms and therefore I'm getting charged. How can I either completely stop my phone sending mms messages or stop this conversion happening. Thanks!"
"181","Hello"
"182","It's quite incredible that Samsung would not provide compatibility between the only free, full-featured file transfer client for Samsung and the S10 series."
"183","Hello"
"184","My Samsung TV 3d TV drove me mad after the Smart IPTV always stopped working"
"185","So I bought an S10 on the Samsung site and sent my (almost new, perfect condition) S8 back in the envelope they sent me (I packed it in its old box and wrapped that in bubble wrap). I used the Post Office's 24 hour signed for service, which cost me £7.40. I checked the tracking number a few days later and it showed up as delivered and signed for at the Samsung recycling centre the next morning. That was 2 weeks ago."
"186","Does anyone have the Samsung Galaxy s10. If you do please, either email me or message me on messenger. See I really need someone who hasn’t downloaded fortnite yet. I need them to download it, make a new account, play three games and get the free bundle in the fortnite store. Once you’ve done this I really need you to tell me the account email and password so then I can get the skin. I want it so bad and have been searching for HOURS!! Thanks for reading."
"187","Hi. Why can't I browse all my photos when wanting to upload pics to a selling site? The photos that appear are 187 out of 1000+ and not any of the ones I want to upload."
"188","So until the other day I could simply pull down the status bar and reply or mark as read on WhatsApp via this method. However this has now changed and neither option is highlighted. Anyone know how I can get this back as it was massively helpful. It works when a standard text comes in but not whatsapp"
"189","Can't believe they remove this feature from Pie. Seriously? The only reason people choose to use Androids is the freedom, not the restriction, why remove such good feature? Please put it back."
"190","I have no idea why it is doing this other i have noticed cpu usage is much lower when reading and when it writes that same 4kibq8t8 where i get there higher score the cpu is 100% why is it not utilising the cpu properly when reading?"
"191","Good evening all you Kats & Kittens. Just wanted to say hey & leave all with an update on the status of my home theater system thanks to your putting up with all the questions I had. Well I was trying to make neat all the cables & the like, when to my horror, I knocke over my 55"" QLED Series 6 TV. Only 18 months old. I just recied my new set (a 58"" UHD NU7100 Series 7 I guess I will find out tomorrow if all the home theater peripherals will be compatible. But you can rest assured that I will be tethering this brute to the wall. Don't know what has happened to font size but for some reason it just just up a notch or two."
"192","Yesterday my wifi decided to drop out, for no apparent reason. I'm on holiday and it was working fine. It auto reconnected to the network (remembering the details from when we were here last time). Everybody else's devices are connected fine."
"193","Help screen timeout keeps resetting itself to 30 seconds even though I chose 10 minutes"
"194","My screen on time have been significantly shorten after the april security patch! My battery drain so quickly!:("
"195","I keep getting pop up ads after I dial a number on my s10+"
"196","This is getting ridiculous. I've never liked Bixby."
"197","Good evening,"
"198","The latest device update was supposed to improve camera performance of the device but actually it totally destroyed the camera performance of this device. Please fix this issue as soon as possible. After the update camera now clicks extremely blurry and noisy images....."
"199","Hello,"
"200","Hello all I did a quick search and nothing came up. Trying to decide between these 2 tablets. I know there is a lot online about these 2 tablets but thought it best to bring this to the home of the gadgets."
"201","Make gaming laptops with purely minimalist design (as Macbook Pro) and classic colors."
"202","I have just purchased an A70 and am concerned that it is not genuine. It looks real and the build quality seems good but I have a couple of things which are preventing me from being completely satisfied."
"203","I've just upgraded from s6 to s10. I've gone into settings and in language and input I've selected English and French. However when I use any apps or text I cannot switch between languages on the keyboard (in the past I could swipe on the space bar to switch language and keyboard layout"
"204","Hello guys am considering one of these 2 tablets however worried because the 64gb storage will not be enough as I use a lot of apps. Is it possible to transfer apps to sd card with any of these 2 tablets please?"
"205","Hi Folks,"
"206","I have an S8, an S9+ and an S10+. All unbranded."
"207","Hi since yesterday YouTube stop working I tried reset the hub and unplugged the tv still no luck any suggestions"
"208","I'm having problems in my A70 with multi-touch."
"209","I’ve been struggling for days with lip sync issues on Dolby Digital via optical."
"210","Hi everyone"
"211","Please could someone help? My Samsung Galaxy A3 keeps losing/dropping my home wifi. Apart from re-starting the phone and router (which is about 1 foot away from me!) could anyone give me some simple step-by-step instructions (if any) to perform on my phone please. Many thanks! xx"
"212","I've had the Galaxy Watch for a couple of weeks and been somewhat frustrated at it's inability to accurately record my sleep. But today it pulled off a neat trick. Across 5 hours of walking down to the shops, pottering around the house and general busy activity, it faithfully recorded all my steps. But it also recorded that I was asleep during 3 hours of that time! Is this a new feature?"
"213","Hi,"
"214","Hi"
"215",NA
"216","I am finding that when my phone is in my pocket the lock screen is changing to landscape from portrait while the screen is locked can any one help"
"217","Had the phone since launch, but last week just as i was going away, went to plug the phone into the car to use Android Auto and couldnt get a connection, my Leads plug wont go far enough into the phone to connect."
"218",NA
"219","Since the new Bixby upgrade, I find that when I ask Bixby to call a contact in my phone, it hears what I say and it shows up on screen but I then get a message to say that the contact doesn't have a phone number. I hate to say it but when I use OK Google for exactly the same task, voila. I am really trying hard to use Bixby but the new update is vexing to say the least. Does anyone else find the new update is worse than the old one? Hopefully Samsung will do some more testing on English accents."
"220","My YouTube app has stopped working properly. Videos don't load and get stuck on the loading screen. I have tried to reset smart hub and the full television but it didn't work. How can it be fixed as the main reason for buying a smart TV was to connect to YouTube seamlessly. Really disappointed."
"221","Air view and pointer are on on in settings, however they dont work anylonger on my tab s4. Anyone else with this problem? How can i fix this?"
"222","I've been trying to get my watch to track my bench press routines and shoulder press routines, but it just sits on the screen telling me to get into position. Any help to solve this issue is greatly appreciated. I've tried doing a few sets, but it never starts tracking."
"223","My camera has started showing what looks like a white bony finger shape when taking photos and videos. It's clear if taking selfie. This has just happened. Any idea"
"224","If i download music fron u tube, do i have to use my 4g to listen to it when im not at home? Is that even possible? I like walking and am wondering can i just use my data to listen to my music from you tube."
"225","Have recently purchased the Tab5se, really impressed."
"226","Hi Everyone,"
"227","When trying to enroll a fingerprint, it keeps reporting ""wipe sensor"". Eventually it gets enrolled but I had to touch about 40x. When authing, same thing. At best I need 3 tries to get authed but often more."
"228","Hello. I noticed today that the Youtube app stopped working properly. The model is UA43K5300. It starts, shows the videos thumbnails, but when I click any video, the Loading text pops up and the screen goes black. By moving the arrow keys, I noticed, the video didn't load at all as the user interface of the video is still intact with the total time of the video stuck at 0:00. All the other buttons work fine. Sometimes, if I click on the next video in that screen, the video plays. I checked if there is a system update on the TV or not and it said no update. Please, kindly solve the issue."
"229","I recently bought the i10 tws and using them with other devices (PC, tablet) I never had any bluetooth communication problems except on my Samsung Galaxy A50, when I listen to music at home by connecting to the WI-FI the signal is transmitted fine and uninterrupted, things change when I use mobile data, the signal continues to skip tenuousness even when attached to the ear. I tried everything, I searched on the internet and I found nothing, I changed the SIM from slot 1 to 2 and even there nothing I reset WI-FI, mobile data and bluetooth settings and nothing changes I emptied the cache I tried to interrupt so many services that I thought could bother the connection and nothing I'm desperate I don't know what to do. Please help me"
"230","hi there"
"231","Hi,"
"232","Opened my albums up today to find all the unfiled photos in Camera folder of Gallery have been deleted. How can I retrieve them?"
"233","My Galaxy A7 (2018) that I bought in January did not receive a single update to this day."
"234","Happens after the last update (May update). Look on the status bar when the phone unlocks. A black bar appears for an instant and then disappears. Only happens with screen off. If I unlock the phone with the screen on, do not happens."
"235","Hi."
"236","Hello,"
"237",""
"238","Hello All"
"239","Hi,"
"240","Hello,"
"241","Okay, so I am asking them about updating my Galaxy Watch to the new One UI update, and they seem to try to educate me that the watch doesn't run on android One UI, and that it runs on Tizen 4. They have no idea what is going on with your software, and they should be the support. Just give the the email of the developers so I can at least talk to someone that knows what is doing, not just saying stuff to make me stop asking. Here is a screen shot it is in Bulgarian, just translate it. Unacceptable. The works thing is that reporting a software issue made them request my device to be sent to a service center?!?! Wow!"
"242","After the latest firmware update of the KS8000 to 1233 youtube only starts once correctly with all the clip-suggestions etc. When I shut down the tv via remote and restart youtube opens, however the clips aren't there. It's all black and I cannot open any."
"243","Why are the apps I once used now saying that they don't exist anymore and if I want to delete the apps?"
"244","I've had my Tab A since Christmas 2017, and never had much of a problem with it. It's only done this once before, but shutting it down for a while and turning it on again solved it. This time it hasn't. Every single app closes (or tries to, in the case of Autodesk Sketchbook, because it asks if I want to exit first) ten seconds or less after I open it. I can't even Google anything longer than 3 words because my keyboard closes automatically, and Chrome has even gone back multiple pages, and then closed when it gets back to the new tab page. Sliding down to see all my apps does it too. I've literally watched it slide up on it's own not even two seconds after sliding down. According to my settings, everything is up to date, so idk what the heck is going on."
"245","I was listening to music and in the middle of a song the earphones quit working, the song was still playing just no sound coming out. I have tried 4 different sets of earphones none of them work. Phone calls, videos or games still no sound through earphones. I have restarted my phone 4 times nothing has changed. Any ideas on how to fix this issue??"
"246",NA
"247",NA
"248","I don't know what I have done but it has deleted 3 quarter of my contacts. I was doing some sort of sync."
"249","I've had my Gear S3 Frontier since Christmas but the back button has stopped working in the Las couple of days and is completely unresponsive. Is anyone aware of a simple way to fix this? Tried rebooting but it still doesn't work."
"250",NA
"251","After Android Pie update (I believe), on every call via handset or speaker phone, the same sound is played for ANY notification (email, text, ring, KiK, etc.)."
"252","Hi all , in the settings I have the screen unlock sound off but I've been getting a random beep when I unlock the screen , anyone else have this irritating issue"
"253",NA
"254",NA
"255","Solved! Go to Solution."
"256","Hello."
